{
  "$schema": "./_override.schema.json",
  "base": "792ceda1f8c190d23a8b35f799ad7a260c888746825f85f2fb285bd3fd630949",
  "finish": {
    "pos": [-198.3, 121, 271.9],
    "quat": [-0.266367, 0.909352, -0.081115, 0.309108]
  },
  "mission": "int_01_hoverJet",
  "notes": [
    {
      "at": "2026-09-30",
      "what": "TEST FIXTURE (DEV-538), never a course: ring 3 down 10 m, ring 10 removed, one ring added after ring 15, the first turn indicator 20 m east, the finish up 5 m, the line refitted from every tenth 2016 point, and 170 s."
    }
  ],
  "rings": {
    "add": [
      {
        "after": "12660756",
        "key": "ov:1",
        "pos": [-1035.6, 147.5, -73.7],
        "quat": [-0.000537, 0.976076, 0.002409, 0.217417]
      }
    ],
    "move": {
      "1259263715": {
        "pos": [603.2, 273.6, 1332.1],
        "quat": [0.143813, -0.48286, 0.080744, 0.860026]
      }
    },
    "remove": [
      "1399968268"
    ]
  },
  "route": {
    "points": [
      [-761.6, 149.6, 2008.2],
      [-691.4, 153.8, 1941.3],
      [-545.2, 162.2, 1843.8],
      [-263, 173.3, 1728.6],
      [62.6, 195.1, 1598.9],
      [358.4, 225.8, 1462.8],
      [626, 293.2, 1318],
      [847.5, 457, 1164.7],
      [1009, 619, 1003],
      [1093.5, 699.5, 831.1],
      [1091.8, 702.4, 654.4],
      [947.3, 564.5, 479.1],
      [784.8, 407.6, 301.8],
      [738.8, 360.5, 120.6],
      [723.2, 339.4, -63],
      [697.4, 281.9, -246.2],
      [660.2, 252, -434.8],
      [582.7, 302, -643.9],
      [507.6, 405, -843.4],
      [473.3, 573.9, -1000.8],
      [464.6, 741, -1138],
      [491.1, 831.7, -1265.1],
      [516.2, 880, -1384.8],
      [501.3, 888.3, -1509.3],
      [462, 877.6, -1619.8],
      [401.9, 872.8, -1710.3],
      [318.4, 864, -1754.8],
      [196.5, 856.5, -1714.2],
      [77.2, 829.4, -1622.2],
      [41.8, 771.9, -1512.6],
      [-45, 658.6, -1345.4],
      [-346, 405.8, -1104.1],
      [-696.8, 178, -751.4],
      [-1005.4, 136.5, -156.9],
      [-1218, 206.8, 416],
      [-1214.2, 416.5, 696.4],
      [-1102, 620, 838],
      [-948.8, 663.2, 922.8],
      [-756.6, 600, 895.6],
      [-557.6, 378.1, 710],
      [-328, 162, 422],
      [-5.7, 147.6, 12],
      [263, 188, -338.8]
    ]
  },
  "timer": {
    "bonusParTime": 170,
    "timeLimit": 170
  },
  "turnIndicators": {
    "move": {
      "1849918450": {
        "pos": [1258, 734, 891],
        "quat": [-0.501577, 0.073747, -0.850007, 0.143073]
      }
    }
  },
  "v": 1
}
