{
  "$schema": "./_override.schema.json",
  "base": "ac96dcedf9d7584d8c4d759ab9e24c03741754e38bc79ef978f7974d584f9695",
  "mission": "int_01_hoverJet",
  "notes": [
    {
      "at": "2026-09-30",
      "what": "TEST FIXTURE (DEV-541), never a course: 2016's line refitted by Edit the line, then control point 8 pushed 60 m sideways, so the line misses ring 6. The racer proof must go red on it."
    }
  ],
  "route": {
    "points": [
      [-761.6, 149.6, 2008.2],
      [-539.4, 162.5, 1841],
      [17, 190.4, 1618.7],
      [552.8, 265.9, 1361.7],
      [737.9, 361.7, 1244.9],
      [950.9, 562, 1072.4],
      [1094.4, 700.4, 827.4],
      [1023.3, 686.9, 648.5],
      [832.8, 454.3, 368.6],
      [764.7, 387.7, 254.6],
      [719.4, 333.8, -86.6],
      [661.6, 251.7, -429.7],
      [503.8, 415.5, -857.5],
      [464.6, 738.7, -1135.5],
      [516.1, 878.7, -1380.2],
      [466.3, 878.1, -1611.4],
      [324.6, 864.8, -1754.4],
      [77.5, 829.5, -1622.5],
      [-43, 660.3, -1347.7],
      [-567.1, 246, -911.1],
      [-818.7, 145.2, -544.3],
      [-1063.9, 143.6, -19.4],
      [-1227.1, 219.9, 455.7],
      [-1228.7, 364.2, 655],
      [-1178.9, 504.8, 754.8],
      [-1091, 628.5, 848.7],
      [-1021.7, 658.1, 896.8],
      [-927.2, 661.1, 926.5],
      [-754.8, 598.8, 894.6],
      [-622.6, 463.5, 784.2],
      [-513.7, 322.1, 655.8],
      [-358.7, 177.3, 459.7],
      [-142.9, 136.6, 189.5],
      [263, 188, -338.8]
    ]
  },
  "v": 1
}
